"Field Name", "Example Values", "Field Type", "Notes"
"source_as_*",,,"See: :ref:`as_* fields <as-*>`"
"source_category",,"keyword","Future: from entity mapping"
"source_geo_*",,,"See: :ref:`geo_* fields <geo-*>`"
"source_location_name","Chicago, US, Datacenter 01,  Bismark - Finance","keyword","Field is derived either from an internal enterprise network definition or the Geo location fields if availble"
"source_mac","a0:b4:44:01:a9:d1","keyword","MAC address of host, colon-delimited and lower case"
"source_priority","critical, high, medium, low, informational","keyword","Future: from entity mapping"
"source_priority_level","1-5","byte","1 = Critical, 2 = High, 3 = Medium, 4 = Low, 5 = Informational"
"source_reference","IPv4,IPv6, hostname,fqdn","keyword (normalized:loweronly)","Mapped from source_ip or source_hostname in that order"